<?xml version="1.0" encoding="UTF-8" ?>

<device xmlns:xsi="http://www.w3.org/2001/XMLSchema-instance"
        xsi:noNamespaceSchemaLocation="validator.xsd">
    <name>Sven</name>
    <origin>Russia</origin>
    <price>1900</price>
    <type>
        <cooler>true</cooler>
        <energy>1000</energy>
        <ports>
            <USB>USB</USB>
        </ports>
    </type>
    <Critical>false</Critical>
</device>